score,datetime,author,title,selftext,permalink,sentiment,compound
9,2018-09-10 16:28:26,VGinNYC,DVR is terrible! 30FPS and Skips on Jag-Giants Game!,"So, I tried watching my DVR recording of Sunday's Jags-Giants game, and I gave up:

a) I'm still seeing that low quality 30FPS when watching the recording on my Apple TV.

b) Numerous skips present while watching the recording. Very obvious when seeing the NFL game clock jump down several seconds each time a skip occurs.

I know the DVR is still in beta, but this is not a good sign. It's been in beta for months (over a year?), and some basic functions still don't work right.",https://www.reddit.com/r/DirecTVNow/comments/9eooql/dvr_is_terrible_30fps_and_skips_on_jaggiants_game/,negative,-0.7425
8,2018-09-07 04:22:08,MagicSilver,Fine the whole damn game then decides in the 2 minute warning I don’t get to watch anymore, ,https://www.reddit.com/r/DirecTVNow/comments/9dqs5j/fine_the_whole_damn_game_then_decides_in_the_2/,negative,-0.5106
6,2018-08-29 21:56:29,rdy105,DVR recording shows I didn't schedule,"I noticed that my DVR is recording South Park - something that I did not set up. I can delete each future recording in Upcoming Recordings but that is a pain. I searched for the show and it gives me the option of scheduling the series. I did and then cancelled, but the upcoming recordings remain.  Any thoughts?",https://www.reddit.com/r/DirecTVNow/comments/9bdp3u/dvr_recording_shows_i_didnt_schedule/,negative,-0.7876
9,2018-07-17 01:38:23,D3aDP00L4,I'm starting to really get tired of DTVN with all their issues!,First they increase their plan price and still can't fix their bugs?? We need a strike,https://www.reddit.com/r/DirecTVNow/comments/8zgy6i/im_starting_to_really_get_tired_of_dtvn_with_all/,negative,-0.4643
9,2018-07-08 22:39:35,chascates,"Sorry, we're not allowed to stream this program to this device",But it's *The Producers* on **TCM**! I can switch to the channel before and after it and switching back I get a second of the 'splash' screen for the movie then the error message shows. First time I've ran across this.,https://www.reddit.com/r/DirecTVNow/comments/8x5gl6/sorry_were_not_allowed_to_stream_this_program_to/,negative,-0.6114
8,2018-07-03 04:52:30,Pointyspoon,Does anyone know of a site that compares all streaming plans and their channel lineup?,Trying to see what is missing between ytv and dtv (go big),https://www.reddit.com/r/DirecTVNow/comments/8vpgqo/does_anyone_know_of_a_site_that_compares_all/,negative,-0.296
7,2018-06-30 15:58:13,scinn3,DVR is so frustrating!,I’m constantly get the error message “This content has an issue and can’t play. Give it another try or select something else to watch.”  When I select something else in My Library I get the same message. Is this happening to others?!?!  I know it’s beta but it is so frustrating when you can’t watch the shows you dvr. I really want DTVN to work well so I can get rid of my cable but that doesn’t look like that will occur for awhile. Bummer. ,https://www.reddit.com/r/DirecTVNow/comments/8v2r7g/dvr_is_so_frustrating/,negative,-0.7564
8,2018-06-24 12:45:59,eXplicit815,"No channels are playing, getting error message: ""This contrnt has an issue and can't play."" Error Number 10006-008","Anyone else having problems watching channels this morning. Getting error message on all channels, ""This content has an issue and can't play. Give it another try or select something else to watch."" This is happening on the Roku app. ",https://www.reddit.com/r/DirecTVNow/comments/8thklv/no_channels_are_playing_getting_error_message/,negative,-0.8176
9,2018-06-14 02:40:23,mgmrick,Problems are real,Now before you attack. I have said my issues are rare using att lte internet. Tried to setup daughter tonight at her home using spectrum 100 meg download internet. After what took what seemed like forever her guide did load. But live tv would not load. Went through normal steps. Restart uninstalled reinstalled app same issues on a brand new second generation firestick. Fired up our att hotspot on phone. Yes your right it loaded right up no issues. As it stands right now could not get dtv now to load with spectrum internet,https://www.reddit.com/r/DirecTVNow/comments/8qyd0n/problems_are_real/,negative,-0.743
7,2018-06-07 16:56:50,spazz75,DVR has gotten worse,"Is it just me, but it seems like DVR has gotten worse.  All of my recordings this week has been incomplete.  Total junk.  ",https://www.reddit.com/r/DirecTVNow/comments/8pby8p/dvr_has_gotten_worse/,negative,-0.4497
8,2018-06-07 01:27:27,infensys,A complete hot mess!,"Doesn’t work for me on Roku. Was watching CMT 2018 awards. 

Try to run on FireTV, told I have too many streams going. I have none right now. 

AppleTV down as well. 

Service is brutal. Had to switch back to Vue, but they don’t have CMT. 

",https://www.reddit.com/r/DirecTVNow/comments/8p69b1/a_complete_hot_mess/,negative,-0.2598
8,2018-05-30 08:01:08,subdriver97,Overcoming losing unlimited Internet usage when switching from U-verse to DirectTV Now,"I signed up for DirectTV Now last week and contacted AT&T today to cancel U-Verse.... I had tv-internet bundle including U300 for $94/mo and Internet-50 for $30/mo... Before I switched to DirectTV Now I verified in my last bill that I had unlimited internet usage... what I didn’t know was the unlimited internet usage was due to having a TV and Internet bundle... I was told if I cancelled U-verse TV Service my Internet would be limited to 1TB/mo... I’m only half way through my billing cycle and I have already used 760GB... I ended up switching to the lowest price eTV-Internet bundle for $49/mo that included very basic U-verse TV service (very few channels, no DVR, no HD) but allows me to retain the unlimited Internet usage... So I would say my $35/mo DirectTV is package is really costing me $55/mo... but still a lot cheaper than $94/mo... and I have all the channels I want except the CW local station...",https://www.reddit.com/r/DirecTVNow/comments/8n6t27/overcoming_losing_unlimited_internet_usage_when/,negative,-0.7003
8,2018-05-22 11:55:17,alpha68,LastPass extension causing login loop,"I haven't had any of the login loop issues since the release of the 2.0 app for the web, until yesterday. DTVN watchnow worked in incognito windows so I started disabling various extensions in my chrome browser until I found the culprit: LastPass!

If you have this problem, try disabling the LastPass extension. It may work.",https://www.reddit.com/r/DirecTVNow/comments/8l9edx/lastpass_extension_causing_login_loop/,negative,-0.8799
7,2018-05-20 20:39:56,mnsportsgeek,No Locals When Travelling,"I thought the new app specified that one of the new features was that you could view the locals of whatever market you are in. I just checked my current location and I should be getting the local CBS, Fox, and NBC where I’m at but whenever I try to view them I get an error saying it’s not available in my area.

Anyone able to get this feature to work?",https://www.reddit.com/r/DirecTVNow/comments/8kvdka/no_locals_when_travelling/,negative,-0.631
7,2019-05-02 23:48:10,drock21023,Osprey Beta 2 Box - Force HDR,Wow. I just got my beta box and it forces HDR to be on all the time. Horrible idea and I find it hilarious that they didn’t realize they should never have done this. They must have been testing on non HDR TV because no way these should have ever left with having no option to auto detect a HDR program or at least be able to turn it off.,https://www.reddit.com/r/DirecTVNow/comments/bk1uvw/osprey_beta_2_box_force_hdr/,negative,-0.1027
7,2019-04-19 16:59:28,_billthecat,Can anyone explain the per month price jump.,"Started service at $30/month plus $5 HBO. Lag and Glitches have only become worse as prices have gone up. I’ve been on the fence since my price rose to $45/month. Emails said I could keep my package, but I guess it’s $55/month without authorizing any changes for worse service and hidden customer help. Almost forgot the 10pm east coast DVR glitches. What are they doing?",https://www.reddit.com/r/DirecTVNow/comments/bf1hek/can_anyone_explain_the_per_month_price_jump/,negative,-0.5187
6,2019-04-17 00:54:09,Flatpavment01,Lose grandfathered plan price if another promotion is applied???,"So I just got a 10/month discount because of
Service issues and received an email that the promotion would be applied to my account. It also mentioned that after that I would be charged 75 bucks a month even though I have a grandfathered go big plan which is 50 per month currently. 

I had another chat session where I was informed if another promotion is applied you lose the previous promotion. Now non of this was explained to me and I only figured it out by reading the email they sent. 

To me this is extremely manipulative and misleading. I can’t help but feel they were trying to get one over on me as a 30 dollar overall promotion is not better than a 25 dollar per month savings through the grandfathered price. 

Did anyone else know this detail? It seems chat reps are being dishonest by leaving out very important details about how pricing and promos work.",https://www.reddit.com/r/DirecTVNow/comments/be1mk6/lose_grandfathered_plan_price_if_another/,negative,-0.8936
7,2019-04-05 02:17:58,barcastuff123,Fire TV 2nd Gen Not working,"Anyone know how to fix this? I have the fire tv 2nd gen the box with Ethernet port.

&#x200B;

DTVNow works on every other device we have. I cleared cache and data also uninstall that seem to work but if i go on another app like Fubo watch a show there then go back it stuck on the loading screen with every channel",https://www.reddit.com/r/DirecTVNow/comments/b9lm68/fire_tv_2nd_gen_not_working/,negative,-0.1154
8,2019-03-29 04:19:50,AxeMuley,Fire tv app not user friendly,"Is it just me or does the directv now interface lack the ease and user friendliness of other apps?  I have the fire tv, and when I open the directive now app it immediately begins playing some random show or movie, and when I scroll down to view the guide the movie continues streaming which is very annoying. Another thing I noticed is that we just started watching Game of Thrones and when I open the list of episodes they are in what seems a backwards order of the final to the beginning or earlier episodes.  Just seems like a unintuitive platform.  ",https://www.reddit.com/r/DirecTVNow/comments/b6sv3b/fire_tv_app_not_user_friendly/,negative,-0.4443
6,2019-03-23 12:21:51,Shaundogg83,Discount up for grabs. I won't be coming back no matter how much they bribe me., ,https://www.reddit.com/r/DirecTVNow/comments/b4ikj9/discount_up_for_grabs_i_wont_be_coming_back_no/,negative,-0.4404
7,2019-03-18 14:03:18,Dkg010,travel channel app / food network app etc,"Anybody having trouble entering activation codes, keeps taking me to bad links when i select directv now as my provider. also the apple activation doesn't work. anybody have any work arounds?",https://www.reddit.com/r/DirecTVNow/comments/b2j3j9/travel_channel_app_food_network_app_etc/,negative,-0.7351
5,2019-03-12 12:20:27,dukedynamite,Support Rep states Early Grandfathered Customers won't see price increase.,"Contrary to everything we've heard. I contacted DTVN support yesterday, and they had a supervisor call me. He told me that the Grandfathered customers that originally had the $35 Go Big Promo would not see the rate increase that was ""rumored"".   


However, I reminded him we got the $5 increase last summer, and he acknowledged it. And said there are no promises but there are no plans to charge those particular customers going forward. He gave me a $10 bill credit for next month. It says I owe $30 on April 11, 2019.   


So take that with a grain of salt. I still don't trust them.",https://www.reddit.com/r/DirecTVNow/comments/b074xl/support_rep_states_early_grandfathered_customers/,negative,-0.3603
7,2019-03-10 18:57:39,noahesmann,"Price Hike, any other options?","So im on the live a little plan, and enjoy most of the viacom channels (mtv, nick, etc). I know that if i pay $10 more I can keep the package I am already in. Is there any other streaming services that offer what the live a little did for the same price? Overall i am satisfied with DTVN, but change insnt bad sometimes. ",https://www.reddit.com/r/DirecTVNow/comments/aziywe/price_hike_any_other_options/,negative,-0.5333
6,2019-02-22 19:55:34,baggs17,NBC Sports Bay Area and California,Both these channels have disappeared from my guide. Did I miss something?,https://www.reddit.com/r/DirecTVNow/comments/atm0oq/nbc_sports_bay_area_and_california/,negative,-0.3612
6,2019-02-20 20:02:12,TheDetective2,No more 72 hr rewind on TCM?,Did they completely removed 72 hr rewind from TCM?,https://www.reddit.com/r/DirecTVNow/comments/assy8p/no_more_72_hr_rewind_on_tcm/,negative,-0.3736
7,2019-01-30 01:04:11,mike3y,Apple TV - low sound,Any fix for this? It only happens on the Direct TV Now app.,https://www.reddit.com/r/DirecTVNow/comments/al75wv/apple_tv_low_sound/,negative,-0.2732
8,2019-01-01 17:22:28,graymatter86,Audio Not In Sync With Video,A couple channels have audio out of sync with video. Nat Geo Wild seems to be the worst. It just started yesterday. Any others having issues with this?,https://www.reddit.com/r/DirecTVNow/comments/abjw3h/audio_not_in_sync_with_video/,negative,-0.6249
7,2018-12-04 03:38:11,Glenathon,I finally had to quit,"Sorry guys....doing this mainly to vent.  

After 4 attempts across four days contacting support in to unsuccessfully fix a ‘Your account is locked’ issue, I finally have to quit.

I haven’t had service since before Thanksgiving.  After getting back from traveling, I figured I’d get around to calling support when I get bored of messing around on Netflix.  I finally did, so I contacted support and chatted with a guy who said they fixed the account and try in twenty minutes.  No luck.

Contacted support again.  We tried together.  It failed.  Gave me another password and said try again in 2 hours.   I did.  It failed.

Contacted support again.  They escalated it.  They said wait 4-6 hours.  They said they’d email me once the issue has been fixed.  They didn’t.  I waited 24 hours.  It failed

Contacted support again.  Guy tried it.  I explained my frustration.  He said ‘Trust me’.  I didn’t.  It failed.

That’s it.  I’m throwing in the towel.",https://www.reddit.com/r/DirecTVNow/comments/a2wqbf/i_finally_had_to_quit/,negative,-0.6597
7,2018-12-03 06:00:07,noooris,How do you use the 72 hour rewind? I missed the Victoria's Secret Fashion Show on ABC tonight., ,https://www.reddit.com/r/DirecTVNow/comments/a2ltm5/how_do_you_use_the_72_hour_rewind_i_missed_the/,negative,-0.296
6,2018-11-24 14:07:08,bike_buddy,ESPN Content,"I went on vacation for a week, and when I came back I wanted to replay a Formula 1 event.  It now appears that when logged in with my DirecTVNow account, I do not have the ability to watch past events.  Anyone else experiencing this?",https://www.reddit.com/r/DirecTVNow/comments/9zyprl/espn_content/,negative,-0.2411
7,2018-11-22 14:43:51,jcrm2,Can't navigate on Roku,"Can't change channels, nor pull up guide on the Roku stick (3600). Only starts up and plays on last channel. Can't even choose anything on the ""What's on Now"" menu. WTH! ",https://www.reddit.com/r/DirecTVNow/comments/9zen6m/cant_navigate_on_roku/,negative,-0.5307
7,2018-11-22 01:15:49,ErnestGetsElected,No guide on Roku stick? Galaxy S7 can't establish location? WTF is up with this buggy crap,"Ok I'm within my 5 day free trial and I'm seriously about to cancel.  First of all, the app on my roku won't even load the damn guide.  It just says there was a problem or whatever and gives me the refresh button that does nothing.

Secondly, when i open this DirecTV now app on my phone it says it can't establish my location in spite of location permission set and gps signal on.  

Why the hell does anyone stick with this bs?",https://www.reddit.com/r/DirecTVNow/comments/9z9dvk/no_guide_on_roku_stick_galaxy_s7_cant_establish/,negative,-0.9067
7,2018-10-24 00:06:15,Sim3111,"Right when WWE Smackdown starts, channel is frozen... good grief, why why why","Title says it all, once again, when a WWE show is about to start, here comes the problems, we had this problem a month or 2 months ago? DirecTVNow was down entirely and many of us missed RAW. Wonder if its time to get a credit for this inconvenience?",https://www.reddit.com/r/DirecTVNow/comments/9qumjm/right_when_wwe_smackdown_starts_channel_is_frozen/,negative,-0.8217
6,2018-10-13 19:42:07,mivajh6,ESPN2: “The owner of this program doesn’t allow it to be streamed to your location”,What’s the deal with this error?,https://www.reddit.com/r/DirecTVNow/comments/9nwmjw/espn2_the_owner_of_this_program_doesnt_allow_it/,negative,-0.3016
9,2018-10-04 00:19:03,arich35,Website Down?,"Every time I sign in on Google Chrome I get an HTTP Error 504 message, anyone else having this issue?",https://www.reddit.com/r/DirecTVNow/comments/9l6x3d/website_down/,negative,-0.4696
6,2018-09-25 23:26:14,jp0ll,"MSG, MSG+, and YES suddenly not playing?","Starting today, about 10 minutes ago, I was watching YES Network when suddenly the channel stopped and I was presented with this message. "" Upgrade to Watch This. This channel is not part of your package. Please upgrade your subscription."" Is this happening for anyone else? I tried contacting chat but so far they have been absolutely useless. ",https://www.reddit.com/r/DirecTVNow/comments/9ix7mz/msg_msg_and_yes_suddenly_not_playing/,negative,-0.2875
7,2018-09-13 15:43:16,Devildog820,HBOGo Not Activating (Something Went Wrong) Solution and Possible Explanation,"I had this issue when activating HBOGo. No matter what I did it wouldn't work and I couldn't get anything other than ""Something went wrong"" as a response. After solving my issue, I have a theory. Check the TL;DR at the bottom if you just want to fix the problem.

Here is my guess. AT&T is consolidating their various services together. Anyone who does this for a living on the server side knows what a nightmare it is to accomplish. When AT&T integrated DirecTV NOW, they screwed up the authentication chain. Your DirecTV NOW password is ""good"", but it doesn't match your main AT&T password. I would suspect AT&T authenticates DirecTV NOW, then uses the same secure password hash to authenticate into their main system and it fails. That's why if you put in a wrong DirecTV NOW password, you get a different error message.

    Your password -> converted to secure hash -> authentication success at DirecTV NOW -> forward secure hash to AT&T account -> failure

I noticed that after trying it a lot in a short period of time. My DirecTV NOW account got locked out for invalid password attempts even though I was cutting and pasting it. I confirmed I was able to use the cut/paste to log in to the DirecTV NOW website.

I reset my password at DirecTV NOW and noticed it said my password would change for all AT&T services. Sure enough, I tried to log in to my main AT&T account with my AT&T password and got a bad password error. I used the DirecTV NOW password and got right in. So, reset your AT&T password using the DirecTV NOW site (just to be sure they properly propagate it through the system). After that, you should be able to use your new password to successfully authenticate HBOGo.

&#x200B;

**TL;DR - Change / Reset your password on the** [**directvnow.com**](https://directvnow.com) **site. It will change your main** [**att.com**](https://att.com) **password too, but it will fix the ""Something went wrong"" error you are getting. Also, ensure you log in to the DirecTV NOW website with a browser to finish setting up your account (create security questions, etc.).**

&#x200B;

**edit: My passwords are the same on DirecTV NOW and AT&T. I also merged all my accounts within AT&T, using the consolidator on their website. That could have affected things too.**",https://www.reddit.com/r/DirecTVNow/comments/9fj37h/hbogo_not_activating_something_went_wrong/,negative,-0.8316
8,2018-09-11 21:19:23,tommens_kittens,Trialing DTVN. Is it me or is there just hardly any ondemand content?,"I've been using SlingTV for a while and am generally happy with it. The problem is that local broadcast channels (Fox, NBC, etc) are not available in my market.  They are for DTVN, so I started a trial.

Service seems ok for the most part, but there seems to be practically no catalog of on demand content compared to SlingTV. Am I missing something?  Why would Dish Network have better content than DirectTV? I'd expect their arrangements with the various networks to be about the same.

",https://www.reddit.com/r/DirecTVNow/comments/9f1hl1/trialing_dtvn_is_it_me_or_is_there_just_hardly/,negative,-0.2359
7,2018-09-10 04:07:57,brthomas,Tried DVR for first time,"I’ve had DTVN since day 1 but only really use it to watch live news. But Only $15/month with ATT unlimited discount.   Recorded a football game from ESPN yesterday and tried to watch it a couple hours later. Good lord what a mess!  Seemed like it froze every 15 minutes and restarted at the beginning. I could fast forward on the Apple TV back to after it froze but certainly a pain. I will keep it since it’s only $15 and I don’t watch that much, but is it always this bad?  If so I really can’t understand how they could release a product that poor or why it’s so technologically difficult for them to figure it out. ",https://www.reddit.com/r/DirecTVNow/comments/9ejitl/tried_dvr_for_first_time/,negative,-0.9231
7,2018-08-17 23:36:02,CranialFlatulence,Why the hell won't the DTVN guide load for me? Apple TV 4k,"I really want to stick with DTVN. I really do. For the price point they definitely have the best channel line-up, but the damn thing just won't work. I started my trial with YTTV+Philo and was going to drop DTVN, but for the second time on Fox an NFL game isn't available on YTTV because ""This program isn't available for streaming on the internet"" or some bullshit like that. I assume DTVN doesn't have any trouble streaming it....which is why I want to stick with them.

Unfortunately the damn guide simply will not load. I've power cycled the ATV4, closed the DTVN app, and everything else I know to do and it simply won't load. I simply get the flashing, blank guide. Is there any way to fix this or am I screwed? I don't want to go back to paying for cable, but if DTVN wont' work they leave me no choice.

/rant",https://www.reddit.com/r/DirecTVNow/comments/9874zr/why_the_hell_wont_the_dtvn_guide_load_for_me/,negative,-0.9471
6,2018-08-17 00:02:57,Hyperman360,Has stability been really bad for anyone lately?,"Over the last month or so, I've started getting the stream breaking up then completely failing a lot, especially in the evenings. Anyone else having issues like this?

I'm on a Roku Premiere, 100Mbps connection.",https://www.reddit.com/r/DirecTVNow/comments/97xj7i/has_stability_been_really_bad_for_anyone_lately/,negative,-0.7388
6,2018-08-03 19:27:25,pcserenity,Trial Questions (Roku) VERY buggy,"So I'm trying to find a cord-cutting solution for some elderly family members that are very used to full Comcast packages and just looking to trim that bill without giving up much. We tried several options and each one of them so far (Sling, PSVue, Hulu Live TV, etc.) have failed to hit some minimums.

DirecTV Now is the current test and, so far, I'm a bit surprised at what I'm seeing and not seeing.

1. Can you not pause a channel and then continue on??? Every channel I've tried allows me to Pause, but the moment I hit play again it just jumps to live again missing the period where I was paused. That's a rather useless ""feature"". Am I using it wrong?
2. MANY of the features I'm seeing just fail to work. I keep selecting programming (with the down button) to play and virtually all of them say there was an error and that the programming isn't able to be played. The trial is the full package trial.
3. The NBCSN channel. Does anyone know if it's local? In other words, I'm in the Philly market. The cable version of this channel will get you Phillies, Sixers and Flyers games. Will this be the same?

Thanks.",https://www.reddit.com/r/DirecTVNow/comments/94cmfm/trial_questions_roku_very_buggy/,negative,-0.8529
8,2018-08-01 16:58:24,cilvaringz,Remove non-subscribed channels from guide?,"Recently my guide has been showing all movie channels (hbo, starz, showtime) which I am not subscribed to and I don’t see an option to only list my package channels on the guide. 

Is there an option somewhere that I am missing to remove these networks o can’t see?",https://www.reddit.com/r/DirecTVNow/comments/93qrh6/remove_nonsubscribed_channels_from_guide/,negative,-0.3736
7,2018-07-11 00:25:37,charmandersc,AppleTV app guide is not loading,"The channel ""guide"" has not loaded in over a week. It just pulses as if it's buffering and no content ever loads. I'm using the newest version of the DirecTV Now app on Apple TV. What's going on?",https://www.reddit.com/r/DirecTVNow/comments/8xuuoh/appletv_app_guide_is_not_loading/,negative,-0.296
7,2018-07-08 13:52:57,crazymick,DTVN 2.0 app always opens to ESPN??,"I may be remembering incorrectly but the old app opened to the last channel you watched.  The new app always goes to ESPN no matter what device I open it on.  Pixel 2XL, Roku Ultra, web.  Always ESPN.

Anyone else?",https://www.reddit.com/r/DirecTVNow/comments/8x1k7v/dtvn_20_app_always_opens_to_espn/,negative,-0.4922
7,2018-06-28 01:18:09,dallasboy,You can’t watch a show while recording?,"So recording a show tonight (2 hour show), I started to try to watch when it was about an hour in....it goes right to live and not to the beginning. I assume once the recording is done, then you can watch it? Kinda a bummer. ",https://www.reddit.com/r/DirecTVNow/comments/8uf5fg/you_cant_watch_a_show_while_recording/,negative,-0.3954
