score,datetime,author,title,selftext,permalink,sentiment,compound
184,2019-03-20 19:56:29,PerezidentOTUS,"We Get It, You Cancelled.",We get it.,https://www.reddit.com/r/DirecTVNow/comments/b3gldu/we_get_it_you_cancelled/,negative,-0.25
121,2019-04-05 22:28:29,psufan5,Lawsuit: AT&T’s DirecTV Now is a flop and AT&T lied to investors about it, ,https://www.reddit.com/r/DirecTVNow/comments/b9xkwj/lawsuit_atts_directv_now_is_a_flop_and_att_lied/,negative,-0.7096
103,2019-03-13 19:30:10,chiefVetinari,Why would anyone ever start subscribing to DirectTVNow at this point?,"Forget about existing customers, sounds like it will stay the same for us. Any new customers won't have standard channels such as AMC or HGTV????

Honestly it blows my mind that those channels are still available to us but a new customer has no way if getting them. I've never seen anything like it. This is essentially a way to kill the service.",https://www.reddit.com/r/DirecTVNow/comments/b0q6im/why_would_anyone_ever_start_subscribing_to/,negative,-0.7757
91,2019-03-22 04:37:52,lohrehn,"The Viacom warnings got worse. It went from a banner at the bottom, to a box on the side, to bouncing all around the screen like a DVD logo.", ,https://www.reddit.com/r/DirecTVNow/comments/b40prh/the_viacom_warnings_got_worse_it_went_from_a/,negative,-0.4215
79,2019-04-30 20:26:13,cwavig,Commercials that increase their volume are a total pice of shit.,Enterprise has increased the volume to well over 300% its insane I will have my volume low really low and it still manage to rattle the walls.,https://www.reddit.com/r/DirecTVNow/comments/bj85at/commercials_that_increase_their_volume_are_a/,negative,-0.6124
76,2019-03-20 19:13:25,JoyousGamer,So many complaints it broke DTVN Help on Twitter, ,https://www.reddit.com/r/DirecTVNow/comments/b3g2qd/so_many_complaints_it_broke_dtvn_help_on_twitter/,negative,-0.4728
74,2019-03-13 08:55:40,dfnj123,"“Your package, loaded with top-rated channels, is no longer available to new subscribers at your rate. How’s that for a reason to keep streaming?“", ,https://www.reddit.com/r/DirecTVNow/comments/b0jqpr/your_package_loaded_with_toprated_channels_is_no/,negative,-0.296
68,2019-05-02 02:02:50,phoonie98,Undeniable with Dan Patrick commercials,"Good lord enough with this horrible commercial already. It’s pretty much a PowerPoint slide with garbage elevator music, and it runs NON STOP.",https://www.reddit.com/r/DirecTVNow/comments/bjpjvn/undeniable_with_dan_patrick_commercials/,negative,-0.2401
66,2019-03-16 00:53:03,noooris,Immediate $10 discount for 3 months by just clicking 'I want to cancel',Seems that 'support' are so overwhelmed with people canceling that they just automated the $10 discount for 3 months.  You no longer have to chat with anyone to get this.  Just click 'I want to cancel' and on the next page you will be offered $10 deal.  ,https://www.reddit.com/r/DirecTVNow/comments/b1mljz/immediate_10_discount_for_3_months_by_just/,negative,-0.4559
63,2019-03-11 21:24:40,about_350,"Literally the first thing you see on the DirecTVNow website is The Walking Dead, a show new subscribers soon won't be able to watch","They did an awesome job of ""learning what the market demands"" and “thinning the content out to channels that are really relevant to customers."" Who needs AMC when you can have CNBC World?",https://www.reddit.com/r/DirecTVNow/comments/azz0n1/literally_the_first_thing_you_see_on_the/,negative,-0.0516
66,2019-03-10 17:55:41,Angry1000,"Yeah, we know our DVR sucks, theres no live pausing/rewinding, but here! Lets cut half the channels and charge you 10$ more a month!",Can't wait to see the next quarter numbers tank again. Went with Philo and a tablo for OTA a week ago and will never look back. I pay 21/month and get all channels and DVR I could ever want. ,https://www.reddit.com/r/DirecTVNow/comments/azi9sn/yeah_we_know_our_dvr_sucks_theres_no_live/,negative,-0.4749
64,2018-10-08 16:20:52,MinutesFromTheMall,Service Down for Anyone Else?,"Looks like DirecTV Now just went down (again) around 12:15 pm EST. Channels appear to start loading, but result in an error message.

AndroidTV and iOS.

Ugggghhh!",https://www.reddit.com/r/DirecTVNow/comments/9mgbh5/service_down_for_anyone_else/,negative,-0.4753
60,2018-07-01 01:03:29,KP3889,Live a Little price increased from $35 to $40/month,"So now we are paying for the handicapped DVR service. 

EDIT1: price for all packages go up. Fuck this. 
EDIT2: alternatives to consider if you want to switch: Sling TV, Playstation Vue, Hulu Live TV, Youtube Tv, and if you have a roku Philo (thanks u/ottuser)",https://www.reddit.com/r/DirecTVNow/comments/8v6ffk/live_a_little_price_increased_from_35_to_40month/,negative,-0.3353
58,2019-01-30 15:02:09,roger320,Directv now loses 14% of subscribers (267k) in 4th quarter, ,https://www.reddit.com/r/DirecTVNow/comments/aldhst/directv_now_loses_14_of_subscribers_267k_in_4th/,negative,-0.3182
58,2018-09-15 19:39:59,Dragon_MyAss,How come you guys never told me I could page down/up on the guide with AppleTV?,Just found out if you slide your finger on the right edge of AppleTV remote that the guide can scroll by pages instead of channels. A lot less frustrating.,https://www.reddit.com/r/DirecTVNow/comments/9g4b6x/how_come_you_guys_never_told_me_i_could_page/,negative,-0.3832
54,2018-08-03 02:11:19,WayneRooneysHairPlug,"Well, that sucks ass...", ,https://www.reddit.com/r/DirecTVNow/comments/945lcl/well_that_sucks_ass/,negative,-0.1027
55,2019-03-29 14:17:58,fenderbender67,"I keep trying to quit, but...","With the recent price hikes and the continued frustration over the DVR, I (once again) researched the other options. And once again, I can't switch. DTVN has the best selection of channels that my wife and I both want. Every other service seems to be missing one or more key channel. I like PSVue's features, but without History and Viacom channels, it won't fly.

I tried HULU this week, and found the interface difficult to use and confusing (on Apple TV). I also felt like the picture quality was worse than DTVN. And, no Viacom channels.

YouTube has hardly any channels.

And DTVN has UP, a channel that no other service offers, and one that my wife enjoys.

So, I guess I'll continue to put up with the crappy DVR and sometimes locked up Guide. Even with its flaws, DTVN still provides the best value for us.",https://www.reddit.com/r/DirecTVNow/comments/b6xtwk/i_keep_trying_to_quit_but/,negative,-0.0702
52,2018-10-18 18:43:27,trackman13,I’ve been a member since the beginning. Is it just me or is a “last” or “previous channel” button the only thing that is really missing.,I’ve been a member since the beginning.  Is it just me or is a “last” or “previous channel” button the only thing that is really missing?,https://www.reddit.com/r/DirecTVNow/comments/9pc172/ive_been_a_member_since_the_beginning_is_it_just/,negative,-0.6106
53,2018-06-12 01:02:26,windycityinvestor,Dtvn just went down. Atv app won’t even display error message,"From chicago. Anyone else having problems. 


Edit: it’s 8:43 central time and my service is back. Based off people’s messages, many are getting or got their service working again too. ",https://www.reddit.com/r/DirecTVNow/comments/8qer43/dtvn_just_went_down_atv_app_wont_even_display/,negative,-0.6597
50,2019-03-14 14:27:42,TedDanson-,Wow the top tier packages are crazy money!,"What's the point of plus and max when so many channels are missing? To get, for example, MLB Network and NFL Network, you now need to pay over $100+ per month.

So many other channels missing now. It's cable pricing all over again.

Ridiculous.",https://www.reddit.com/r/DirecTVNow/comments/b10ywd/wow_the_top_tier_packages_are_crazy_money/,negative,-0.5255
51,2018-09-29 16:52:42,mb10240,"Cancelled service, received 100+ ""We'll Miss You"" emails within 3 minutes.", ,https://www.reddit.com/r/DirecTVNow/comments/9jyj3k/cancelled_service_received_100_well_miss_you/,negative,-0.3818
51,2019-04-09 18:48:37,bryan_lucas,"I know that many on-demand shows have “disabled the fast-forward function”. I don’t have a problem with the ads. But, I’m finding that many won’t let you skip to the middle of the show. This is really annoying when you want to resume half way through and can’t. Especially when the stream fails.", ,https://www.reddit.com/r/DirecTVNow/comments/bbbpc3/i_know_that_many_ondemand_shows_have_disabled_the/,negative,-0.8438
46,2019-02-01 22:09:01,ANTIROYAL,Been seeing a lot of you complaining about the service with ATT/DirecTV. Figured I'd leave this here., ,https://www.reddit.com/r/DirecTVNow/comments/am7fe0/been_seeing_a_lot_of_you_complaining_about_the/,negative,-0.25
46,2019-04-14 22:52:34,tsmartin123,'Game of Thrones' Season 8 Premiere Reportedly Leaked by DirectTV, ,https://www.reddit.com/r/DirecTVNow/comments/bd8rnq/game_of_thrones_season_8_premiere_reportedly/,negative,-0.3182
46,2019-03-11 02:06:03,The1stHorsemanX,Consensus from AT&T employees,"I work for AT&T and after speaking to reps across my district, the general opinion from everyone I've talked too is that corporate has lost its mind with these DTVN changes. The leading theory at work is that this is AT&T is purposely destroying DTVN to pave the way for a new streaming service launching in a month or 2 and it doesn't want to compete with itself. We've heard rumors of something in the pipe but no one knows anything substantial.

I actually use DTVN(we get the ""Gotta have it"" package for $10) and it was a tough sell to begin with, but now it's an absolute joke.",https://www.reddit.com/r/DirecTVNow/comments/aznk83/consensus_from_att_employees/,negative,-0.3841
45,2019-01-27 03:35:20,noooris,Leaked Pricing Details Licensing Costs Per Channel For Live OTT Services, ,https://www.reddit.com/r/DirecTVNow/comments/ak8glh/leaked_pricing_details_licensing_costs_per/,negative,-0.3182
39,2018-07-26 00:48:27,mshanks1,blah Is Everyone Else's DTN down as well?,"I am only geting the initial channel to load and thats it. The rest say ""hmm this seems to be taking to long"" or ""channel is behaving badly"" 

Guide doesn't work, nothing is working. Trying to watch SharkWeek",https://www.reddit.com/r/DirecTVNow/comments/91xmub/blah_is_everyone_elses_dtn_down_as_well/,negative,-0.34
36,2019-02-02 14:23:53,terryjohnson16,AT&T confirms Directv Now will not support ESPN3,https://www.cordcuttersnews.com/att-confirms-directv-now-no-longer-offers-espn3/,https://www.reddit.com/r/DirecTVNow/comments/ameh40/att_confirms_directv_now_will_not_support_espn3/,negative,-0.3089
35,2018-06-06 03:44:32,AmberTim,“Your network seems to be underperforming”,I’ve had DTVNOW for almost a month and have had zero issues. I pay for unleashed internet so I know my speed is not an issue. Could this error be attributed to my internet company or DTVNOW? ,https://www.reddit.com/r/DirecTVNow/comments/8oxgja/your_network_seems_to_be_underperforming/,negative,-0.5461
32,2019-03-19 21:08:47,Ventem,Yet Another Reason to Leave,"I'm watching Nickelodeon with my family right now and there's a big banner on the bottom talking about AT&T DirecTV deciding to drop Viacom altogether rather than renew their contract. 

I can only assume this would impact those of us who are grandfathered into their old plans as well since AT&T would no longer support those channels, but it's not clear. 

The banner includes a phone number and a [link](keepviacom.com) to a site with more info. 

I'm going to talk to the significant other tonight about switching to YouTube TV with Philo to get everything we need, while also lowering our TV bill. 

I've been mostly ignoring the criticism lately since I would be grandfathered into a good plan, but it sounds like I'm going to be losing channels while my monthly bill will be staying the same. No thanks. 

Edit: Link isn't working for whatever reason, but the site is keepviacom.com for those who are curious. ",https://www.reddit.com/r/DirecTVNow/comments/b32x0j/yet_another_reason_to_leave/,negative,-0.2905
31,2018-06-25 23:50:11,Jumpingmanjim,AT&T Employees Reportedly Encouraged to Use Unethical Sales Tactics to Drive Up DirecTV Now Subscriptions, ,https://www.reddit.com/r/DirecTVNow/comments/8tvd2g/att_employees_reportedly_encouraged_to_use/,negative,-0.2023
31,2018-06-24 03:28:02,ReadItWithSarcasm,Guide is Driving Me Nuts,"Not only is it too damn complicated to get to the guide, the experience using it is driving me bonkers.

Why in the world did they put the channel preview in the middle of the screen instead of on top - where it won’t cause the guide channels to jump all over the place?  It's so annoying. Scrolling through channels can probably trigger epileptic seizures with the way things jump all over the place. 

Does DirecTV visit this sub? Where can I leave some feedback?",https://www.reddit.com/r/DirecTVNow/comments/8tf59o/guide_is_driving_me_nuts/,negative,-0.8142
29,2019-04-18 16:08:53,SWPorLTE,"Not sure if this is already known, but Discovery Channel login now works","Stumbled onto this Tuesday while trying to catch up on Deadliest Catch.  DTVN login worked on the Discovery Go app on Apple TV, seems I can use the app now.",https://www.reddit.com/r/DirecTVNow/comments/bencxc/not_sure_if_this_is_already_known_but_discovery/,negative,-0.1232
30,2018-06-14 20:59:39,ryanasimov,"Nearly every multi-season TV show that is available On Demand has missing episodes and/or entire seasons. I understand distribution rights are to blame, but I've got to ask: What's the point of an incomplete On Demand library?", ,https://www.reddit.com/r/DirecTVNow/comments/8r5cp7/nearly_every_multiseason_tv_show_that_is/,negative,-0.5106
30,2018-12-21 04:14:12,UTlexus87,Does anyone else have issues with random shows appearing in their DVR that you have not selected to record?,I have been getting weird shows appearing in my library that I know I have not recorded.  Even a Spanish version of one show (weird).  I am the only person on my account and no one else uses it so I know that it is not someone else accessing my DVR.,https://www.reddit.com/r/DirecTVNow/comments/a867uf/does_anyone_else_have_issues_with_random_shows/,negative,-0.4404
30,2018-09-11 00:07:02,windycityinvestor,ESPN completely sucking for MNF,"Keeps on freezing and when it comes back from commercial, the audio is of the game but screen still shows the Att logo and the commercial counter is frozen at 0.

I’m on Apple TV in Chicago. I’ve restarted the app twice.",https://www.reddit.com/r/DirecTVNow/comments/9esiny/espn_completely_sucking_for_mnf/,negative,-0.0516
31,2018-07-29 17:36:10,Bangarang0011,Is it just me?,Does anyone here actually like the interface on DTVN? I like the content and picture quality but navigation is a pain in the ass. I mainly use Apple TV 4K and avoid using it altogether on the native app for my Roku TV at all all cost. ,https://www.reddit.com/r/DirecTVNow/comments/92wgjd/is_it_just_me/,negative,-0.897
26,2018-12-31 19:58:00,90days4Life,Taking bets on if DirectvNow will have a service outage tonight during the ball drop, ,https://www.reddit.com/r/DirecTVNow/comments/abamn4/taking_bets_on_if_directvnow_will_have_a_service/,negative,-0.2732
27,2019-04-01 11:23:18,sophias_bush,So the Apple TV 4K promo is back...,Who in their right mind would sign up for it with these ridiculous packages they offer 🤦🏼‍♂️ ,https://www.reddit.com/r/DirecTVNow/comments/b8100t/so_the_apple_tv_4k_promo_is_back/,negative,-0.3612
24,2018-06-07 01:12:03,DarknusAwild,Uh are streams complete garbage,"Ever since i updated the app today every channel hasn’t worked.  

This content has an issue...
Your network is underperforming...

Blah blah blah

No you updated your app to complete shit.

Wtf is going on?

Entire streams are completely dead now.  Blue bar of death nothing loading.  “Hmmm this video is taking longer to load.”

Now menus aren’t even working, channels not showing shows etc.",https://www.reddit.com/r/DirecTVNow/comments/8p65n2/uh_are_streams_complete_garbage/,negative,-0.9652
24,2019-03-20 17:04:35,javiergame4,"AT&T responds to Viacom: ""Several channels are no longerpopular anymore""", ,https://www.reddit.com/r/DirecTVNow/comments/b3eiv0/att_responds_to_viacom_several_channels_are_no/,negative,-0.296
25,2019-03-11 19:30:32,roger320,Anyone else concerned that DTV now is no longer offering new customers a reasonable product?,"I’m on the Grandfathered plan and I got to say I am quite happy with it.  It’s a lot of channels for $40 a month.  Not happy about $10 more a month, but I would pay it.  

More concerned that the new plans are terrible and I am thinking it’s probably only a matter of time before DTV now as a whole gets shitcanned and I lose my $25/month discount.  ",https://www.reddit.com/r/DirecTVNow/comments/azxm4g/anyone_else_concerned_that_dtv_now_is_no_longer/,negative,-0.6963
23,2019-05-02 16:15:28,88flux,"New beta box users with ""dead"" boxes... turn it on","Just a heads up to all. I received my Osprey today just like many have this week. I've seen multiple people posting in various threads about how their box seems to be DOA after having gone through the setup process. Mine appeared to be the same way as well. Set it up and then got nothing even after a power cycle. It's because it was booting into powered off state. Just hit the on button on your remote and it'll turn on.

Can't promise that it's the same for all.

The box is designed to be turned off when not in use to conserve data since it streams automatically whenever turned on. So what you may perceive as a dead box might just be because it is turned off. Try turning it on and hopefully you'll be good to go.",https://www.reddit.com/r/DirecTVNow/comments/bjwt22/new_beta_box_users_with_dead_boxes_turn_it_on/,negative,-0.2721
23,2018-07-09 23:01:12,_billthecat,"Is it me, or is now almost impossible to contact DirectvNow customer service?",Bad customer service is AT&T’s normal way of doing business though,https://www.reddit.com/r/DirecTVNow/comments/8xhe1q/is_it_me_or_is_now_almost_impossible_to_contact/,negative,-0.5423
24,2018-06-13 02:31:31,sargskyslayer,Buffering For Days,"I am forced to use AT&T fiber internet at my apartment (100mb speed 3 feet from Roku) and I decided to use DTVN instead of getting locked into a contract. About every 2 to 3 minutes the app sits there and reloads. When I went to DTVN website for troubleshooting tips, they said it is most likely due to a bad WiFi signal. It’s funny how they blame themselves but do nothing...",https://www.reddit.com/r/DirecTVNow/comments/8qowg2/buffering_for_days/,negative,-0.3919
23,2018-06-07 12:49:25,Amwebprop,Totally useless since I switched off Beta to new version.,"Day one subscriber here.  I suffered through the garbage that was DirectTVNow in the earliest of days, hoping they would improve or die.

Finally, with the release of the Beta (2nd Gen FireTV) I had a stream I could actually watch.  It appeared the DTVN engineers had finally ironed out a couple of bugs.

Since I removed the Beta and installed their ""new"" version of DTVN, I have not been able to watch one program I wanted to watch.  Buffering, freezing, out of sync audio, you name it.  I have over 200 MBPS speed for God's sake!

I tried to Live Chat support last night, and their login page brought up a black screen.  They can't even get their own website to work.

I think this is it for me DTVN.  I have zero confidence that you have any clue how to develop a reliable stream to more than just small segments of your user base.  $35 a month for Go Big seems cheap until you realize you are just stacking 35 $1 dollar bills each month and lighting them on fire.  ",https://www.reddit.com/r/DirecTVNow/comments/8pa11k/totally_useless_since_i_switched_off_beta_to_new/,negative,-0.3788
23,2019-05-08 18:47:00,alaskanjackal,Annoying but not unexpected. (Original messaging implied charge would be $30/month.), ,https://www.reddit.com/r/DirecTVNow/comments/bm936c/annoying_but_not_unexpected_original_messaging/,negative,-0.2144
21,2019-02-06 03:44:22,Osoroshii,Pause Live TV :(,"I’m nearing the end of my run with DirectTVNow. The service has grown in features (and in price) since I became a subscriber. The one thing that is sorely missing, pausing live tv. Sure you can hit pause and it keep a small cache of stored footage but really only about 30secs at most. If you get an important call or something else’s that need attention while watching live tv you end up missing some of the show. ",https://www.reddit.com/r/DirecTVNow/comments/anmla0/pause_live_tv/,negative,-0.3612
24,2018-11-29 18:39:27,dirk1218,DTVN DVR is getting worse,"Wow I am only a month in to my DTVN service and the DVR function seems to get worse and worse.  Everything is skipping to the point you have to delete it and wait for the on demand episode to show up.

&#x200B;

Wish I would have kept my DTV service.  ",https://www.reddit.com/r/DirecTVNow/comments/a1k1hc/dtvn_dvr_is_getting_worse/,negative,-0.5106
20,2019-05-11 20:53:36,_billthecat,$10 more a month = System wide failure., ,https://www.reddit.com/r/DirecTVNow/comments/bngvzu/10_more_a_month_system_wide_failure/,negative,-0.5106
21,2019-04-27 00:39:30,jlhendo,Undeniable on Audience promos,"I'm gonna go ahead and say it:  the promo commercials for Dan Patrick's show on Audience freak me the hell out.  So I don't know about you guys, but for me most all of the slots for commercial breaks which had been getting filled by just the ATT logo landing page have been replaced by a promo for Undeniable.

It pops at like once every other commercial break, and not only is it obnoxious how often it runs, but the style it's edited (with everyone kinda of having bobble heads, can't real describe it) gives me the willies.  Please tell me I'm not the only one getting really annoyed of those commercials...",https://www.reddit.com/r/DirecTVNow/comments/bhtlzi/undeniable_on_audience_promos/,negative,-0.7498
22,2019-02-17 16:40:19,Locutus508,DVR Stopped Recording,Anyone else's DVR stopped recording?  I haven't been able to record a show since early Friday.  I have missed over 10 shows now.,https://www.reddit.com/r/DirecTVNow/comments/arm73v/dvr_stopped_recording/,negative,-0.6124
22,2018-10-24 15:59:29,fenderbender67,So buggy the last month or so...,"AppleTV here... Several weeks of black screen, app crashing, poor DVR recordings, etc. So frustrating. I wish another service offered the channels that DTVN offers. I'd switch. 

BTW - is the DVR officially the longest BETA ever in the history of software development???",https://www.reddit.com/r/DirecTVNow/comments/9r0xle/so_buggy_the_last_month_or_so/,negative,-0.66
20,2019-02-10 15:38:23,packetfire,"""Too Many Streams"" - Serious lag in replication/sync between AT&T Servers","I have 3 Roku Ultras in 3 rooms, and one account that is claimed to allow 2 streams at once.

Despite only playing one TV at a time, and taking great care to exit DirecTVnow to the Roku ""Home"" screen before leaving one TV for another, I am subjected to ""Too Many Streams"" errors, that persist for extended periods of time.

But, by running around the apartment like a madman, and starting DirecTVnow again, then exiting on each and every Roku, and then sitting quietly with a cup of tea and a book for about 1/2 hour,  I can then, once again, watch some news.

So, this implies 2 different problems (are you paying attention, AT&T employees?)  

&#x200B;

a) Data sync between servers is too slow - replication of ""active"" stream records are thereby different on different servers. 

b) Some ""exit"" events seem to be falling on the floor, and never being replicated to other servers, or not being ""caught"" at all, as the start app / exit app sequence on each TV seems to resolve the longer ""deadlock"" cases. 

&#x200B;

There has been a litany of complaints about ""Too Many Streams"" on all possible platforms, so this is not a Roku-specific issue.  I intend to log these incidents, and to demand credit for each and every day when this happens, thus cutting my bill in half.  If AT&T has problems of this sort, then they need to up the minimum number of streams to account for this lag in their server replication of active stream counts per account.  

&#x200B;

I AM NOT PAYING AN EXTRA $5 PER MONTH TO FIX DIRECTVNOW'S PROBLEM

&#x200B;",https://www.reddit.com/r/DirecTVNow/comments/ap4y75/too_many_streams_serious_lag_in_replicationsync/,negative,-0.7576
22,2018-11-22 16:40:03,eXistenceLies,Guide not loading completely...,Firetv stick not working completely. Android app nothing is loading. Tried all my devices and same problem. Wth? This is Thanksgiving and looking forward to football game. ,https://www.reddit.com/r/DirecTVNow/comments/9zfm2h/guide_not_loading_completely/,negative,-0.7269
20,2018-08-30 14:24:09,jefferson136,PSA: The Apple TV 4K offer is coming to an end on 8/31.,"The Apple TV 4K offer is coming to an end on 8/31. If you haven't taken advantage yet, get it while it last!",https://www.reddit.com/r/DirecTVNow/comments/9bk214/psa_the_apple_tv_4k_offer_is_coming_to_an_end_on/,negative,-0.2575
21,2018-08-22 15:12:11,lynnioos,Apple TV: Channels changing by itself,I haven’t had trouble with any of the other apps I use but last night and again this morning the channels have changed by itself. ,https://www.reddit.com/r/DirecTVNow/comments/99e5m0/apple_tv_channels_changing_by_itself/,negative,-0.2144
