score,datetime,author,title,selftext,permalink,sentiment,compound
3,2018-07-29 00:55:51,mike3y,Theory of why some have problems,"I’m trying to sum up a theory of why some may be experiencing issues with DirecTV Now and some others are not. My current home network consists of a 40/10 connection via Cable. I have a dedicated AP 2.4/5ghz acn. I have a home built router using pFsense with quite a bit of memory and cpu power dedicated to it. I barely have problems. 

The one thing I noticed is DirecTV Now calls for the highest amount of bandwidth then other streaming services. It also may hold more concurrent connections off to their servers. My theory boils down to the routers people are using.

I’d like to see some posts of the people that are having problems, what router are you guys using. And a posting from other people with no problems, what router are they using.

I barely have issues with DirecTV Now. Aside from their global outages. I also use only Apple TV’s.

Let’s see if we can find a connection. ",https://www.reddit.com/r/DirecTVNow/comments/92r14j/theory_of_why_some_have_problems/,negative,-0.5423
3,2018-06-24 00:32:40,livewyr90,So when do I get my channels back?,I use a Roku TV to watch DTVNow and ever since the update I've lost every single local channel I have. I have to use a computer or my phone to watch local channels. How much longer do I have to put up with this?,https://www.reddit.com/r/DirecTVNow/comments/8te6x4/so_when_do_i_get_my_channels_back/,negative,-0.3939
4,2018-06-06 03:46:37,windycityinvestor,CNN issues,"Anyone having issues with CNN streaming?  I’m getting constant freezes and messages that my connection is bad.  Then When the “connection” is good, 10 seconds of the feed is repeated before it froze or error message came up.

But it’s only happening on CNN.",https://www.reddit.com/r/DirecTVNow/comments/8oxgz5/cnn_issues/,negative,-0.296
1,2019-04-30 21:48:26,Nfluenz2,YTTV,"Anyone else thinking of jumping ship to YTTV or YTTV+ PHILO when YouTube releases their app for the fire stick, now that they worked things out?",https://www.reddit.com/r/DirecTVNow/comments/bj95u7/yttv/,negative,-0.34
0,2019-04-25 00:24:23,jake13122,Why is ESPN blacked out regionally?,"I live in New York and the Mets are on ESPN but the game is blacked out.  It's on NATIONAL television, this is ridiculous.",https://www.reddit.com/r/DirecTVNow/comments/bh24hu/why_is_espn_blacked_out_regionally/,negative,-0.5023
0,2019-04-18 16:39:31,Funkyokra,Can renters whose landlord says mo dish get DirectTvNow?,I've had Direct Tv for 15 years to get Sunday ticket. Moved into a new rental house with the agreement we can put the dish on the roof over the patio. Installer says he can't put it there because it's just a tin roof. There are some trees and he says the only place he can put it is on the garage and the landlord wont allow it because it is a new roof and it would violate the warranty. I know some people in apartments can get DirectTVNow if the LL wont allow the dish. If I get it in writing from LL that I cant have a dish can I get DirectTV Now at a single family home?,https://www.reddit.com/r/DirecTVNow/comments/benpq6/can_renters_whose_landlord_says_mo_dish_get/,negative,-0.4003
1,2019-03-31 20:40:52,RubiChick,What happened to SNY?,"Last summer, I had SNY on the ""Just Right"" package. This was one of the main reasons I signed up with DirecTVNow!  

I've been checking the Guide last 2 weeks, and nothing...it's been removed.  I just typed in my zip code on DirecTVNow's website to find out what sports channels are available in my area, and SNY is one of them.

I'm still able to watch all the Mets games on MLB.tv (thank you T-Mobile for the free yearly subscription), but I miss the pre-game and post-game terribly now that the season has just started.

Anyone else? ",https://www.reddit.com/r/DirecTVNow/comments/b7sh2c/what_happened_to_sny/,negative,-0.7432
2,2019-03-30 06:24:43,malchien,My AFTV app has been crappy lately,"The last two weeks or so, my AFTV box will never show DTVN content when I start it. Sometimes I can get it to work if I force stop the DTVN app and clear the cache. Other times I have to restart the AFTV. All my other apps are working fine on my AFTV, so I don't think it's the AFTV. Anyone else having issues with DTVN on their AFTV?",https://www.reddit.com/r/DirecTVNow/comments/b7819g/my_aftv_app_has_been_crappy_lately/,negative,-0.34
2,2019-03-29 00:26:35,grimjoe54,No cinemax on demand,I had cinemax on demand and now I don't. What changed over the past few weeks m,https://www.reddit.com/r/DirecTVNow/comments/b6qmow/no_cinemax_on_demand/,negative,-0.4939
0,2019-03-25 05:27:30,ChoppedLiver99,No more A&E?,"Is there really going to be no more A&E?? I hope that is wrong, otherwise I will be looking somewhere else. UGH!! ",https://www.reddit.com/r/DirecTVNow/comments/b56nr8/no_more_ae/,negative,-0.8393
2,2019-03-23 23:56:51,bcantana,Messed up Local Channels Again,"Basically any non GPS enabled device I try to use DVTN on (Fire TV, Fire Stick, Chrome Browser on PC) I get Raleigh, NC local channels. If I use DVTN on a device with a GPS (Android Phone, Chromebook) I get my Charlotte, NC local channels as expected. It worked a few weeks ago. It seems to come and go. 

What is even more frustrating is that it shows the CW channel for Raleigh in the guide, but when I try to play it, it gives me an error (because the CW channel in Charlotte is not in DVTN yet.)

Once Game of Thrones is done, I'm heading on to something else. ",https://www.reddit.com/r/DirecTVNow/comments/b4pxus/messed_up_local_channels_again/,negative,-0.6055
0,2019-03-23 16:26:25,tristanryan,Is there any reason I would give up the Just Right package for $65 and HBO add-on for $5?,I got the message about the $10 price increase and the new packages. It seems like I would lose a ton of channels and pay more if I changed my package. Am I missing anything?,https://www.reddit.com/r/DirecTVNow/comments/b4l1lb/is_there_any_reason_i_would_give_up_the_just/,negative,-0.2168
2,2019-03-14 14:22:07,Philbob5,Fubo TV possible alternative?,"They just landed Viacom 3 weeks ago and will be coming into their base package soon it is $5 cheaper than my newly priced grandfathered Go Big package and seems to get most of the same channels(missing MLB and NHL networks is the only one's I can find so far)  or am I missing something? I don't need HBO or Showtime as I can just stream them another way... 

Has anyone used them? Is their stream reliable? Do they have any 4k channels? 5.1 Dolby? I just did a quick search sorry. 


Some positives over DTVN and YTTV 

30 hrs of DVR that doesn't expire > 20 with 30 days maximum 

3 streams > 2 

NFL RedZone option plus a ton of extra regionals for sports for $9 

Works on Fire devices as well so no need for side loading ",https://www.reddit.com/r/DirecTVNow/comments/b10wni/fubo_tv_possible_alternative/,negative,-0.4984
2,2019-02-17 23:29:54,scamp9121,Buffering lately?,Has anyone seen a drastic increase in buffering lately? Been happening for 10 days now and bad enough to make it completely unwatchable. Located in the Charlotte area with fiber connection. They gave me a $5 credit for the problem. ,https://www.reddit.com/r/DirecTVNow/comments/arqj8o/buffering_lately/,negative,-0.3939
3,2019-01-21 17:05:51,mistereousone,Switching from PS Vue to DirecTv Now,"I'm supplementing my PS Vue account with Philo to get the channels the wife watches that PS Vue is missing.  DirecTV Now has a better combination so I switched as of about 3 hours ago in part because my Samsung Tv has an app for DTV Now but none for PS Vue.

So the app in the Samsung TV gives me ""Oops there's something wrong."" Restart the app.  Still not working.

Okay not ideal but I set it up through my roku stick.  Same message.

Well let me go to the Roku TV in the other room.  Same message.

Is this what I can expect?  

  

Update:  After several hours of resetting passwords and uninstalling and reinstalling the APP Here's where I am.  
Samsung TV:  I've gotten as far as starting a channel, having the 15 second ad run and then freezing before the actual show starts.  

Roku Stick:  After about 6 hours I was able to watch an episode and a movie.  However prior to that the buffering was so bad that it locked up my stick several times.  

I've got a FireTV that I'm going to try this evening.",https://www.reddit.com/r/DirecTVNow/comments/aic40u/switching_from_ps_vue_to_directv_now/,negative,-0.8885
3,2019-01-13 04:21:10,Nickmedici55,More Simultaneous Streams?,Any chance of getting more than 3 streams at once? I want to subscribe but I’d need bare minimum 5 simultaneous streams. 3 won’t cut it. ,https://www.reddit.com/r/DirecTVNow/comments/affqgq/more_simultaneous_streams/,negative,-0.3313
3,2019-01-03 13:13:22,yaynative,Edge support?,"Does directvnow really not support any browser besides Chrome? I’m thinking of going to streaming only, but hate Chrome. ",https://www.reddit.com/r/DirecTVNow/comments/ac5lk6/edge_support/,negative,-0.5733
2,2018-12-18 01:01:43,GTEE14,Is ESPN3 working for anyone?,ESPN3 is still not working for me with my DirecTV Now account :( is anyone else having same issue still?,https://www.reddit.com/r/DirecTVNow/comments/a761b7/is_espn3_working_for_anyone/,negative,-0.504
2,2018-12-03 13:17:13,ganoveces,Roku Stick and DTVN issues? 5 of 5 devices have issues.,"5th device ive tried that has issues.   

Samsung Smart TV w/dtvnBeta preinstalled - cant watch
Android app on phone - cant watch
amazon fire tv - nope
roku stick (received from dtnv) - will only play last channel watched on pc
windows pc / chrome OS - only works in incognito window 

Installed DTNV channel and get logged it.   It auto plays the last channel that was watched on my laptop. But i cant change the channel.  The guide throws and error.   I can search for channels and see them but they wont play.   It just does nothing.  DTVN is the weak of all sauces. 

I was able to get the samsung smart tv app to log in, but still wont stream anything. 

Guide throws same error ""hmm something is wrong"".   I can search for channels but when try to watch it says a subscription is required for this channel. 

I paid for the $65 sub and it shows that when i open the gear settings and view my account. 

In conclusion,  DTVN is trash.    



",https://www.reddit.com/r/DirecTVNow/comments/a2ojtq/roku_stick_and_dtvn_issues_5_of_5_devices_have/,negative,-0.2479
0,2018-12-01 02:51:47,mrdrmagoo,Oh I'm sorry must be my problem not DirectvNOW,"&#x200B;

https://i.redd.it/2w6ztsr30l121.png",https://www.reddit.com/r/DirecTVNow/comments/a1z8iw/oh_im_sorry_must_be_my_problem_not_directvnow/,negative,-0.4588
2,2018-10-30 12:33:59,triscutbiscut,Logged out every few hours - Chrome,"I know every four hours it asks the are you still there thing, but when I hit yes it logs me out. Every time. Is it me or is it DTN? I also have to login every single time I open the DTN a page. It’s very annoying. ",https://www.reddit.com/r/DirecTVNow/comments/9snetz/logged_out_every_few_hours_chrome/,negative,-0.1128
3,2018-09-01 20:02:15,StellaArtois2016,Can no longer rewind,"I don't think I'm tripping out here, but prior to a week or two ago, I was able to rewind any live TV channel, back to the point I started viewing it (in some instances, back to the beginning of the program). It seems now I can only pause and resume live TV, can't rewind anymore. Is this a change they implemented recently? ",https://www.reddit.com/r/DirecTVNow/comments/9c62zb/can_no_longer_rewind/,negative,-0.1531
0,2018-08-18 23:40:49,Made4tv__,2 straight weeks no local football?,Last week they tell me it's blacked out. This week it's because of an outage they say. Same error message same channel. Is it even possible to watch local games? ,https://www.reddit.com/r/DirecTVNow/comments/98fzt5/2_straight_weeks_no_local_football/,negative,-0.5204
3,2018-07-28 16:17:21,jimah1982,DVR,Just subscribed to Directv Now earlier this week. So far it’s...ok. The app is kind of hard to navigate but I’ll try to get used to it. I realize the DVR is in beta but does anyone else have an issue where if you fast forward or rewind there is no way to tell where you are in the program? It doesn’t advance the actual video and there’s no preview screen like with Hulu that shows the progress. How am I supposed to know when to stop fast forwarding commercials?,https://www.reddit.com/r/DirecTVNow/comments/92na84/dvr/,negative,-0.2861
2,2018-07-20 12:24:55,Silverdreamz1,Between the slow guide and the delay when starting...,"I'm going to lose it! There was an update that changed the style of the guide. Ever since then there is a delay while scrolling through the guide and it makes me crazy! Also, the delay of the app loading when I first turn it on takes so long that i end up going onto Hulu or Prime. I tried contacting Direct TV now to go back to the old version of the app and they told me that they changed it but nothing changed. I access DTVN from a firestick and Roku stick. Does any one have any tips ? I cant imagine I'm the only one that hates the guide delay. ",https://www.reddit.com/r/DirecTVNow/comments/90fja0/between_the_slow_guide_and_the_delay_when_starting/,negative,-0.9167
2,2018-06-18 22:05:32,Cedric205,New update out for Roku (Version 2.0 Build 9),Still no video playback when guide is open on roku stick 3800 models.,https://www.reddit.com/r/DirecTVNow/comments/8s3j5c/new_update_out_for_roku_version_20_build_9/,negative,-0.296
1,2018-06-16 02:04:18,ottuser,"holy crap, hbo restart actually worked this week","just shocked :)

",https://www.reddit.com/r/DirecTVNow/comments/8rg9wu/holy_crap_hbo_restart_actually_worked_this_week/,negative,-0.2263
2,2018-06-05 15:02:37,clickityclack,Login Issues - Why Do They Try to Force ATT Login Info??,"I'm getting so annoyed with At&t and their stupid logins. I have att wireless, uverse, directv, and directvnow, with the wireless and directvnow being separate accounts and login info. However, ATT wants us all to have the same login info for everything, no matter if that's the correct account info or not. UGHHHH",https://www.reddit.com/r/DirecTVNow/comments/8origv/login_issues_why_do_they_try_to_force_att_login/,negative,-0.8491
3,2018-05-26 22:19:47,stosh2k,FireTV audio issues since update,"Current generation FireTV with the latest updated DirecTV Now app.  Experiencing an audio issue when watching a channel, it'll suddenly drop volume by 20%, forcing us to raise the volume.  After an indeterminate amount of time, the volume level returns, blasting us out of a slumber.  

Dolby Digital Plus Automatic is selected as the output on my FireTV.

Anyone else experiencing this? It's driving my family nuts since the update.",https://www.reddit.com/r/DirecTVNow/comments/8mdjuw/firetv_audio_issues_since_update/,negative,-0.5267
3,2018-05-24 00:32:41,Halo-One,First experience using the DVR. Not good!,"Tonight I sat down to watch a show I had set to record. It was freezing, randomly skipping ahead and the audio once cut out. 
This is on an Apple TV 4K.   The show is currently on and I started watching the recording a few minutes after it started. ",https://www.reddit.com/r/DirecTVNow/comments/8loedp/first_experience_using_the_dvr_not_good/,negative,-0.6367
0,2019-02-24 08:21:43,nudgeguy,Direct tv now service,"At first my Direct TV Now service was great , then I began to notice some programs would not download no matter how long I waited. I suspected I was being cheated and canceled the service on 02/20. Since they do not do refunds , they sent me an email saying I still had service until 02/28. But since cancelation , I have not been able to download a single program as of 02/24. This obviously spiteful act proves they can control what is being downloaded and I was right about getting cheated. Watch out for this scam.",https://www.reddit.com/r/DirecTVNow/comments/au60mk/direct_tv_now_service/,negative,-0.9433
0,2018-06-24 23:55:11,JoyousGamer,Have a FireTV and AppleTV? Use the FireTV,"First off know that I am not the biggest fan of the AppleTV to start with. The touch controls I feel cause a input delay I don't get from my other devices.

I am just throwing this out there after using my AppleTV for the first time for DTVN in about a month and a half. The AppleTV app is so inferior its not even funny. (To be clear my AppleTV has been used for HBO/Netflix with no issues so this is not a device issue)

For clarity: On the same network, both on wifi (ATV is actually closer than the FireTV), and been a DTVN subscriber since day 1 (I know how to fix issues and what is ""common"" for my house).

Issues I had
-
- DVR was slow, dropping half the show, and had lots of buffering (example I stopped a show in the middle, went upstairs to the APTV [had to log in], and had these issues on that same episode as well as others I tried)
- Needing to login multiple times (known issue)
- Extra ordinary additional buffering on live tv typically not on FireTV (was not watching a sporting event just normal rerun shows)
- This is personal but swipe not showing the Watch Now/Guide is extremely annoying (it asks for you to push the Menu button)
- Apple TV got stuck in the DVR section of the app with incorrect screen display (DVR show information overlaps the headers)

This is not meant to tear down the service but simply to point out at this point if you have the choice between devices use the FireTV. Its been about a month since I used the Roku (had Beta but not the live version) and I would say if that hasn't changed that Roku would be a better option as well.",https://www.reddit.com/r/DirecTVNow/comments/8tm1k0/have_a_firetv_and_appletv_use_the_firetv/,negative,-0.444
3,2019-05-08 01:20:10,rygelski,1 minute/90 second delay on NBCSports compared to traditional cable feed?,"Got a friend on Comcast. His feed of NHL playoffs is almost 60-90 seconds AHEAD of my DirecTVNow feed. My Internet is 200MB down/10MB up, so doubt it’s fault of poor Internet/buffering. Have others found that live sports are that much delayed compared to traditional cable?  It’s like DirecTVNow is as delayed as an actual satellite signal coming down from space.",https://www.reddit.com/r/DirecTVNow/comments/blz2yx/1_minute90_second_delay_on_nbcsports_compared_to/,negative,-0.8428
2,2019-04-11 13:13:09,Mitchewr,Any Experience with PlayStation Vue?,"Just wondering if anyone on here has tried Playstation Vue at all and how the service compares to DTVN, YTTV, Sling, Philo, etc.

&#x200B;

I was looking at their [channel lineup / pricing](https://www.playstation.com/en-us/network/vue/channels/?dl=access) and, compared to other players in the field (excluding us Go Big grandfathers), it doesn't look too shabby. I just don't know how well it actually works.",https://www.reddit.com/r/DirecTVNow/comments/bbzpvi/any_experience_with_playstation_vue/,negative,-0.2901
4,2019-03-13 16:50:55,rsg1241,How many people have or plan to cancel?, ,https://www.reddit.com/r/DirecTVNow/comments/b0o8rh/how_many_people_have_or_plan_to_cancel/,negative,-0.25
3,2019-02-20 09:25:56,nelco90025,DTVN daily breakdown,"Just me?  Almost every day lately, sometimes twice, I will be watching a live or recorded show, then when done and I switch to choose another program...the On Now images flicker then disappear and all recording are gone too.

But if I close DTVN, open another app then close it and go back to DTVN, things are back again.  Just me?

Fire stick 4k in los angeles",https://www.reddit.com/r/DirecTVNow/comments/asmcfn/dtvn_daily_breakdown/,negative,-0.6007
3,2019-02-19 02:01:05,Chace1693,GUIDE Locals Missing,"All Local stations have been missing in the Guide within Chrome on PC for two days. You can find and watch all via Watch Now and/or in the Discover/Networks areas.  So they are there, they are correct but missing from the guide.  As always Chat is clueless and worthless as to existence or a fix.",https://www.reddit.com/r/DirecTVNow/comments/as51jt/guide_locals_missing/,negative,-0.9022
3,2019-01-01 17:41:09,germ80,Most CNN on demand shows are gone,"I was watching the 2000s series on CNN on demand over the last few days, and this morning (1/1), I can confirm that most shows in the On Demand section of CNN are now gone!  I don't know if the rights expired as of 2019, but I can't finish the series :(",https://www.reddit.com/r/DirecTVNow/comments/abk257/most_cnn_on_demand_shows_are_gone/,negative,-0.7316
3,2018-09-21 01:00:14,TheRealBH,DVR not working for a few days,Has anyone else had this problem with their DVR not recording on multiple days?,https://www.reddit.com/r/DirecTVNow/comments/9hkrer/dvr_not_working_for_a_few_days/,negative,-0.481
2,2018-09-20 12:38:22,godplaysdice_,Did anybody get charged multiple times this month?,"There were 5 withdrawals from my account last night for $40, and a nice overdraft fee on top as a result. I think this might've occurred because I tried to change my billing address online a few days ago and kept getting error messages.

Edit: Chatted with a rep and confirmed that the issue was caused by me unsuccessfully trying to update my billing info four or five times. They will be refunding me.",https://www.reddit.com/r/DirecTVNow/comments/9hexnd/did_anybody_get_charged_multiple_times_this_month/,negative,-0.3818
3,2018-06-17 21:54:59,LowTechDesigns,Still no local channels in Myrtle Beach and Charleston SC,"For some reason, probably related to recalcitrant local broadcasters, we have no local channels on coastal South Carolina. I have an antenna and get ABC/CBS/NBC and PBS out of Charleston, but it still bugs me that this is still the case after DTVN provides locals in many other major markets. ",https://www.reddit.com/r/DirecTVNow/comments/8rud3h/still_no_local_channels_in_myrtle_beach_and/,negative,-0.296
3,2018-05-24 13:13:42,Carbon87,Fire Stick Update = Buffering Hell,"Got the ""update"" for the Fire Stick. Now I can't go more than 10-15 seconds without buffering. My connection isn't the greatest, but I was watching TV just fine 20 minutes ago before the update, and have for months. Wtf did they do to this thing?",https://www.reddit.com/r/DirecTVNow/comments/8lsjbd/fire_stick_update_buffering_hell/,negative,-0.8856
4,2018-05-19 03:15:34,typeXYZ,"DVR, Is the D for Dumb","In setting up my recordings, I always select 'New Episodes'. However with shows like Roseanne or The Middle, it's recording marathon old episodes of these shows. So, with 20hrs this is going to fill up all my recording space. Why can't I get this to record only NEW episodes? I've already tried canceling and setting up the record again, but still does it.",https://www.reddit.com/r/DirecTVNow/comments/8kinlq/dvr_is_the_d_for_dumb/,negative,-0.1027
0,2018-07-10 03:39:35,theMightyMacBoy,“$35 forever” plan going to $40?! WTF AT&T?! Did anyone else get this?!, ,https://www.reddit.com/r/DirecTVNow/comments/8xkrvo/35_forever_plan_going_to_40_wtf_att_did_anyone/,negative,-0.7875
0,2019-05-09 03:02:35,buddah17333,Does the beta box still operate if you cancel?,"Might be a weird question, but since it's loads to live tv I was wondering what happens if you cancel the service if you are still able to access apps? I only use the box in the bedroom so it would mainly be used for Netflix.",https://www.reddit.com/r/DirecTVNow/comments/bmeoh8/does_the_beta_box_still_operate_if_you_cancel/,negative,-0.5733
0,2019-05-01 21:23:06,t-poke,New beta box is DOA,"I just got my beta box today. Plugged it in, and I get the AT&T logo for a minute. Then my TV switches to no signal, where it's been sitting for quite some time. The blue light flashes when I push a button on the remote, so it's responding to that, but absolutely nothing on the screen. Tried unplugging and plugging back in, tried holding the red reset button down, and nothing seems to fix it. Any ideas?",https://www.reddit.com/r/DirecTVNow/comments/bjmot6/new_beta_box_is_doa/,negative,-0.4795
0,2019-05-01 15:15:06,brandawg93,[Question] How do I reset the Beta box?,"I just received the new remote so I figured I would give the beta box another chance. Upon starting it up, it shows the att symbol and loads. After some time, all the lights on the box turn off and there is no picture. If I click home on the remote, the box lights up for a split second but nothing happens on the screen. I've pressed the little red button but that only produces the same outcome. Any other ideas or is my box just dead?

Solved: the red button travels really far inside the box. A fingernail won’t press it in.",https://www.reddit.com/r/DirecTVNow/comments/bji9fk/question_how_do_i_reset_the_beta_box/,negative,-0.6966
0,2019-04-27 22:25:18,smoelheim,A+E Networks Warns Viewers of Possible Blackout on DirecTV, ,https://www.reddit.com/r/DirecTVNow/comments/bi4ec9/ae_networks_warns_viewers_of_possible_blackout_on/,negative,-0.1027
5,2019-04-24 21:34:56,wuzhere,ESPN,"Anyone in the NYC area not getting ESPN? I’m getting the not available in your area error. ESPN 2, ESPN news, and ESPNU all work though",https://www.reddit.com/r/DirecTVNow/comments/bh0c19/espn/,negative,-0.4019
3,2019-04-17 01:43:56,RGDJR,The local sports situation befuddles me,"Is there something wrong with my service or is this just the shitty reality of ditching cable? I've got all my local channels in Pittsburgh through my Live a Little package. But when I tune into NBC Sports to watch the Penguins playoff game (which is already disappointing) I'm told that the game is blacked out in my area. I know that if I were to try to watch a locally broadcast game through [MLB.TV](https://MLB.TV), for instance, it would be blacked out. But this just feels like a situation where I should get to watch my game. If I were to subscribe to Fios, I'd have access to the broadcast—how is this different?",https://www.reddit.com/r/DirecTVNow/comments/be24ih/the_local_sports_situation_befuddles_me/,negative,-0.1179
