score,datetime,author,title,selftext,permalink,sentiment,compound
5,2018-06-12 01:36:17,SondraP,Direct TV Now Constant Interruptions,"When the streaming service works properly, I'm happy.  The problem is that it rarely ever works properly.  Since the ""upgrade"", I can't keep any stream connected on my smart TV.  I can watch five to 10 minutes of a show and I get the ""Something Went Wrong"" error message.  I have to exit the app and go back in and MAYBE I get to watch for another five minutes before it happens again.   I can't count on the service to load on my iPhone or laptop either.  Customer service gave me a $25 credit for next month because of the problems I've had this week but the problems aren't solved. 

About the upgrade with the DVR recording ability \- I don't have it.  It doesn't matter what channel I choose, I am prevented from recording it.  The customer service agent told me, via chat, that I need to wait for a while to see what channels they have copyright permission to record.  Wait?  This is stupid.  So basically my account says I have 20 hours of DVR space per month that I can't use because I'm not allowed to record anything.",https://www.reddit.com/r/DirecTVNow/comments/8qezn3/direct_tv_now_constant_interruptions/,negative,-0.8699
5,2018-06-11 01:15:34,seymourputts,Poor performance on firestick after update,"Has anyone else experienced poor performance with the new app on firestick? Its slow, and buggy. It worked a lot better before the new version.  Is it just not quite right for the firestick anymore?",https://www.reddit.com/r/DirecTVNow/comments/8q5j6m/poor_performance_on_firestick_after_update/,negative,-0.5661
5,2018-06-09 05:36:04,jt0118,Google chrome guide,"Anyone else having issues with google chrome?? I can see select channels through watch now but when I go to guide it says “whoops! Something went wrong. Please refresh the page.” After I refresh it, the message still pops up. ",https://www.reddit.com/r/DirecTVNow/comments/8pqqm5/google_chrome_guide/,negative,-0.4314
5,2018-06-08 13:40:43,nwoidaho,Audience Network GONE from DTVN,"Went to load up the Dan Patrick Show this morning and noticed Audience Network missing from the channel lineup. The Roku BETA was nice but since it became the new 'FINAL' version, there's been a couple of odd things that keep happening. Missing channels has been one of them. ",https://www.reddit.com/r/DirecTVNow/comments/8pjya7/audience_network_gone_from_dtvn/,negative,-0.6652
5,2018-06-08 01:56:12,ImDirtyDan_,Fox Sports South (Atlanta Braves) Blacked Out after Roku Update???,"I've had Fox Sports South and Southeast for years, going back to when I was still a DirecTV subscriber. Watched the Braves game two nights ago with no problems.

After the Roku update yesterday the Braves game was blacked out for me, something that has NEVER happened. I chalked it up to the shit and glitches going on yesterday. Came home today and flipped over to FSSO again, and the channel is unavailable and giving a standard blackout error message. 

This is also happening on my mobile data, and on the Fox Sports Go app, saying to contact my provider as my ""subscription does not include this channel"".

Contacted DTVN's useless live chat and they gave me the crap about how blackouts work and said there was nothing they could do. 

This makes no sense, I am in the channel's region, am paying for it, and have NEVER had this happen until the broken update yesterday. PLEASE HELP I'M SO FRUSTRATED.",https://www.reddit.com/r/DirecTVNow/comments/8pg1r6/fox_sports_south_atlanta_braves_blacked_out_after/,negative,-0.6523
6,2018-06-08 00:37:32,mike3y,Problems again ?, ,https://www.reddit.com/r/DirecTVNow/comments/8pfi3e/problems_again/,negative,-0.4019
7,2018-06-05 14:39:26,rockstang,It's been an interesting first 48 hours [roku 4 & apple tv],"So I must have signed up at a weird in between time. I decided to take advantage of the apple tv deal and cancel sling. I have both Roku and Apple tv devices at home. My initial login was on a roku device. This was apparently inbetween direct TV updating their streams and apps. When I initially logged in I had access to all of my local affiliates. Horray! I live in a rural area in PA and no streaming service had any locals up to this point. According to the zip code check i should have fox but nothing else. So yesterday the app updates and i only have access to fox. I'm a little disappointed, but never expect the other channels to remain available.

That leads me to the second part. The new roku update includes the dvr and new features, but is clearly buggy. Something must be wrong with tje Pied Piper algorithm. It is kinda at an unwatchable level for me with frequent screen flickering and generally low resolution and responsiveness. These issues are not present when watching on Apple TV. I'm assuming an update will fix the problems with Roku. However if not fixed by the end of the 3 months i just paid for, I'll be forced to cancel.",https://www.reddit.com/r/DirecTVNow/comments/8orbtz/its_been_an_interesting_first_48_hours_roku_4/,negative,-0.9545
5,2018-05-31 06:13:40,neemamahmoodi,I keep getting this error. Any ideas?, ,https://www.reddit.com/r/DirecTVNow/comments/8ng49n/i_keep_getting_this_error_any_ideas/,negative,-0.481
4,2018-05-31 05:08:36,blthomas80,NBC buffering most of the night,"Have others had this issue? In addition to the hockey game buffering on NBCSN, NBC also seemed to have problems all night. I noticed it last night too. ",https://www.reddit.com/r/DirecTVNow/comments/8nfmyb/nbc_buffering_most_of_the_night/,negative,-0.4019
1,2018-11-22 17:54:47,jreid77,Canceling my service. I suggest everyone else do the same.,I just switched back to Vue this morning when the guide wouldn’t load on DTVN.  I had Vue before but switched for the cost.  You get what you pay for I guess.  Vue has all my locals and is working flawlessly.  DTVN seems to go out at the worst possible times like today ,https://www.reddit.com/r/DirecTVNow/comments/9zg9xk/canceling_my_service_i_suggest_everyone_else_do/,negative,-0.4215
0,2019-01-09 11:06:55,WJKramer,DTVN ATV tvOS app no longer being updated.,"In the past iOS and tvOS DTVN app updates have come together as it’s an universal app between the platforms. However, since November this has no longer been the case. iOS has received several updates, including last nights, and tvOS has not. I feel like the service has been getting better with every update and it’s unfortunate that the progress has been slowed on tvOS. I can only assume that most of their efforts will be aimed at the android tv DTVN beta box going forward.",https://www.reddit.com/r/DirecTVNow/comments/ae5tx9/dtvn_atv_tvos_app_no_longer_being_updated/,negative,-0.4234
1,2018-11-24 02:17:28,ElBigBad,Your customer service is horrible,"Just wanted to take the time to come say your customer service is horrible.  You couldn't design a worst system.  Really hate it when I google for ""DirecTV Now customer service"" and it takes me to a web page that starts with ""Contact us - Directv Now"" then you only usable options are community, twitter, and facebook.

&#x200B;

&#x200B;

Thanks for wasting my time and provide a horrible experience.  Why don't you instead actually try to be useful?",https://www.reddit.com/r/DirecTVNow/comments/9zuiow/your_customer_service_is_horrible/,negative,-0.8442
1,2019-03-19 21:01:23,drdoomy069,Can the last person out please turn off the lights?,"I see nothing left here but a slow death.  the channels left are no desirable ones, all the good channels are gone from thee new plans  ATT must be scary in debt now to kill dtvn,   I would suggest that instead of killing off dtvn they should just sell off clown network news..",https://www.reddit.com/r/DirecTVNow/comments/b32tta/can_the_last_person_out_please_turn_off_the_lights/,negative,-0.9747
0,2018-06-23 02:12:16,jimc999,Biggest piece of shit service ever. Now the damn guide won’t load., ,https://www.reddit.com/r/DirecTVNow/comments/8t6sqs/biggest_piece_of_shit_service_ever_now_the_damn/,negative,-0.743
1,2018-07-18 22:13:29,Paria2,I Quit..........,From the moment it was rolled out I was a big believer in DTVN and signed up when the Apple TV deal rolled out.  Went for the Beta and have been disappointed  to the point of quitting many times.  Well this morning I put my money where my mouth is and got rid of it in place of YouTube TV.  I couldn't bring myself to sign in to the program one more time and when I did it crashed on my 20 minutes later.  Adios ,https://www.reddit.com/r/DirecTVNow/comments/8zzz64/i_quit/,negative,-0.25
0,2018-10-26 10:10:22,Shaundogg83,Cancelled my Go Big Package yesterday switched to Philo.,"Let me start off by saying that nobody in my family watches sports and we get our news from our local channels. I just couldn't see paying almost $70 a month for all those channels we don't use. Now to the complaints DirectTv Now  on Roku is horrible! It takes forever to load then once it finally does you have to wait for the guide to load. Next the constant buffering is enough to make a preacher swear! I hoped with every update that the app would get better and really it seemed to only get worse. How can a $20 television package work better than a $70 one? I'll never understand but somehow it does! Philo has all the channels we watch except for Disney and Cartoon Network for the kids but we can use Grandma's Spectrum info to watch those on the apps. And then there's the horrible DVR! I was a DirecTV Now customer for several months but I just couldn't see paying for a service so poor any longer. If AT&T doesn't start caring more I think they probably will continue to lose customers, especially if other cheaper services keep adding channels like Philo has been. I also have Hulu and Netflix and my antenna for locals so I'm not missing anything I care about. I doubt I will ever go back to DirecTV Now only because I used it for the entertainment channels but they have a lot of work to do if they want to compete with cheaper services.",https://www.reddit.com/r/DirecTVNow/comments/9rjg72/cancelled_my_go_big_package_yesterday_switched_to/,negative,-0.9584
0,2018-07-12 02:59:52,RalphFromTheFuture,DirecTVNow is a far better experience than DirecTV,"I’m staying at this vacation house that has DirecTV. Its channel setup is terrible. Scrolling through the guide, I have to go past about 20 or so shopping channels and about 30 Cinemax channels just to get to anything decent, and even at that point most channels are junk. Also, each channel has an HD and non-HD version (why even bother with the latter). There are simply too many channels. I know there’s ways to do filters in the guide but I’m only here for a few days so I haven’t bothered figuring it out. 

DirecTVNow has its share of problems, but I’d rather pay for a smaller subset of channels, most of which are decent, than a bloated package of home shopping channels. ",https://www.reddit.com/r/DirecTVNow/comments/8y62sw/directvnow_is_a_far_better_experience_than_directv/,negative,-0.7592
0,2018-06-14 09:14:49,kennypenny666,Why is the fucking onscreen menu covering the whole video??highly annoying when my mouse hovers on it!,"i'm talking about Chrome on windows 10.
Is there a way to disable this??
Or when will they fix it?
What idiot made this??",https://www.reddit.com/r/DirecTVNow/comments/8r0ewf/why_is_the_fucking_onscreen_menu_covering_the/,negative,-0.8048
2,2019-04-24 01:49:53,1mixedCouple,What the hell is up with this upwards of 5 minutes quiet pause!!!? I'm so sick of DTVN, ,https://www.reddit.com/r/DirecTVNow/comments/bgorvm/what_the_hell_is_up_with_this_upwards_of_5/,negative,-0.8938
2,2018-12-05 17:26:21,SethalSauce,Can’t even watch our Presidents funeral.,"Man, this content is not authorized shit is getting old. Three different times during the funeral so far.",https://www.reddit.com/r/DirecTVNow/comments/a3efcs/cant_even_watch_our_presidents_funeral/,negative,-0.2677
3,2018-07-08 23:57:11,jjt3hii,"Holy Mother of GOD!, why are locals not at the top of the guide?!",This is simply unacceptable.,https://www.reddit.com/r/DirecTVNow/comments/8x60t7/holy_mother_of_god_why_are_locals_not_at_the_top/,negative,-0.6341
0,2019-03-12 20:22:35,Early2000sTV-,Why Did DirecTV dump Viacom ?,"MTV is failure in 2019 as well as MTV 2 and TV LAND

&#x200B;

but why did they get rid of the channels?",https://www.reddit.com/r/DirecTVNow/comments/b0ckno/why_did_directv_dump_viacom/,negative,-0.4137
0,2018-08-06 01:30:57,Bangarang0011,Stop whining,"Do people realize that with DTVN you get the most channels for your buck, the largest channel app credentials, and HBO for only $5? 

C’mon people",https://www.reddit.com/r/DirecTVNow/comments/94x2b4/stop_whining/,negative,-0.4767
0,2019-03-23 18:14:04,dinis007,Beware! DirecTV Now stole money from my bank account.,"I don’t even have DirectvNow. I had a free trial period over a year ago for a month and cancelled. They charged me for 3 months, even though it was supposed to be free trial and never refunded my money. TODAY, I was just charged $20 by DirecTV Now and called fraud dept at my bank. They said it was set up as a re-occurring charge. The bank blocked further charges and cancelled my card. There is absolute no number to call anyone at DirecTV Now. And u can’t even chat if u don’t  have an account. 

Edit. Called regular DirecTV, got aggressive, got a supervisor, who then got me to an ATT chat site. That ATT site issued a refund, and cancelled the account they restarted by “computer error”. They emailed me confirmation of both refund and cancellation. I posted to warn anyone who has ever had a trial with DirecTV now to pay attention to you bank account, debit/credit alerts and statements. Enough “computer errors” and they can pair down some of that $192 billion in debt.",https://www.reddit.com/r/DirecTVNow/comments/b4mac8/beware_directv_now_stole_money_from_my_bank/,negative,-0.92
0,2019-03-20 10:30:59,Shaundogg83,Doesn't look good!,DIRECTV NOW May Soon Lose Viacom Channels https://www.cordcuttersnews.com/directv-now-may-soon-lose-viacom-channels/,https://www.reddit.com/r/DirecTVNow/comments/b3adoi/doesnt_look_good/,negative,-0.6595
1,2019-02-26 01:51:09,Angry1000,Cant wait till viacom channels hit a different service and more OTA channels get picked up by a compeditor.,"Honestly, Nickelodeon and all my locals are the only reason I'm still here. Everyday I take a peak at this sub and it's SSDD. ""Why is channel x not working?"" ""My DVR recorded the wrong show!"" ""My on demand isn't showing what I was just watching!"" ""When's the 100 hr DVR coming?!"" ""My screen is stuck loading forever!"" ""Where is the live TV Fast Forward, Pausing, and rewinding?!"" 

At this rate once another service gets good local and Viacom, it's over for dtvnow. Goes to show the cable company thinks they can provide the same shitty customer service to their streaming platform as they do their TV. ",https://www.reddit.com/r/DirecTVNow/comments/autfs1/cant_wait_till_viacom_channels_hit_a_different/,negative,-0.7191
3,2019-03-14 16:51:02,ExtremeComplex,"""However, because programming costs continue to rise, your package will be increasing $10/mo""","So I'm on the ""Live a little"" plan. So that means I have the fewest channels. So the email sent says ""However, because programming costs continue to rise, your package will be increasing $10/mo"" but this $10 is across the board of packages so once again they are lying  by charging everyone the same increase. ",https://www.reddit.com/r/DirecTVNow/comments/b12o37/however_because_programming_costs_continue_to/,negative,-0.3919
0,2018-05-26 16:00:10,LowTechDesigns,"The future of TV is CHOICE, not coercion"," Charter Spectrum came out with an ala\-carte cable TV option recently. You get all your local channels and 10 premium cable channels of your choice. After taxes it is right around $25. I did a free trial and cancelled. They offer it to Internet only customers exclusively and it only supports the Roku box for real TV viewing. It is a sign of fear and weakness for them to capitulate in offering this option that we were told, over ten years ago, was not realistic. How things have changed! I am currently a DirecTV Now subscriber on the grandfathered $35/mo. plan. I recently tested YouTube TV. I’ll be cancelling it too and keeping DTVN. A future offering coming soon is AT&T Watch at $15/mo. It could be a huge game changer. No bloated sports packages, and according to a recent presentation by ATT execs, they will only pay the content providers if customers actually watch their channels! HELLO!!?? This is hopefully the future. Being forced to pay for any package that includes content you don’t want is downright un\-American IMO. ATT is on the right track with Watch. We’ve been bamboozled for too long with cable TV thinking. The future of TV is choice, not take it or leave it. If some channels disappear, good riddance. We shouldn't be forced to support fringe or marginal content providers. ",https://www.reddit.com/r/DirecTVNow/comments/8mb2fk/the_future_of_tv_is_choice_not_coercion/,negative,-0.8035
0,2018-05-20 15:23:01,scarrollodi,Still Not Reliable enough...,"Same old story last night on DTV NOW, could not watch any Hockey or Basketball due to all the buffering and spinning rectangle AND NO it is not my internet connection as I am pinging over 60 mbps. Still just a UN-reliable service like HULU that we are all getting ripped-off for. WILL IT EVER WORK CORRECT AND RELIABLY ???",https://www.reddit.com/r/DirecTVNow/comments/8kt99p/still_not_reliable_enough/,negative,-0.2437
0,2018-07-17 22:37:20,dbv2,Fox News BlackOut Error,"Getting a Fox News blackout error tonight.  I am not sure how Dtvnow can survive with these constant issues and how anyone sticks with them.  How a company be this bad and have absolutely no support?  Of course Chat, just says will escalate.  ",https://www.reddit.com/r/DirecTVNow/comments/8zpu0n/fox_news_blackout_error/,negative,-0.875
0,2018-09-22 19:01:01,Coloneldave,DTVN sucks,After an hour it goes to the home screen. It has been doing this for a while and I hit the DTVN button on Roku and it went back to my station. Now when I do this it goes to CBS every time and I have to scroll through the channels to get back to whatever I was watching. ,https://www.reddit.com/r/DirecTVNow/comments/9i254c/dtvn_sucks/,negative,-0.3612
1,2018-07-19 03:50:38,terryjohnson16,Service is becoming beyond annoying,"I still have the beta app as well as the regular app. I find the beta app more stable than the regular app. I have been having nothing but playback issues on the live tv as well as dvr. Poor streaming on strong lte and wifi

Its crazy. Its like they have us paying extra so they can raise money to fix the issues. We being punished. 

Im sticking around due to the $35 price. 

Iphone 7 plus ",https://www.reddit.com/r/DirecTVNow/comments/902fkx/service_is_becoming_beyond_annoying/,negative,-0.1163
0,2018-12-25 17:54:03,windycityinvestor,Did directvnow just go down on Christmas Day!,"Wtf. Say it ain’t so Santa!

I’m in Chicago. 


Edit: 12:07. We’re back!",https://www.reddit.com/r/DirecTVNow/comments/a9gs0o/did_directvnow_just_go_down_on_christmas_day/,negative,-0.6884
0,2018-07-12 23:06:05,DirectTVNowSucks,DirectTV Now Sucks!,"I use it to access the ""free"" HBO I get through my AT&T mobile account but is sucks. I've been trying to watch Silicon Valley on Roku but it's terrible, this past weekend individual episodes were missing and now I can only access Season 5. ",https://www.reddit.com/r/DirecTVNow/comments/8yeobm/directtv_now_sucks/,negative,-0.9051
0,2019-04-03 16:28:40,OPopinions,App BROKEN,Is anyone else having a perpetual loading screen when opening the app? ,https://www.reddit.com/r/DirecTVNow/comments/b906cd/app_broken/,negative,-0.5904
0,2019-01-06 16:07:56,MONTREALEXP0S,Am I paranoid?,When I restart directvnow it defaults to channels I never watch? Am I paranoid or has my account been compromised?,https://www.reddit.com/r/DirecTVNow/comments/ad6ter/am_i_paranoid/,negative,-0.5484
0,2018-05-16 22:00:18,IndianBird1983,Could you fake location for locals now?,"Since they’ve added the feature where you can travel and receive the locals for the area that you’re in, could you now potentially fake your location to get locals from somewhere that has local channels?",https://www.reddit.com/r/DirecTVNow/comments/8jyxa1/could_you_fake_location_for_locals_now/,negative,-0.7622
0,2018-10-27 03:39:31,NorthOaksGirl,DirecTV NOW Service Complaint results in first-ever refund?," I took advantage of DirecTV NOW's 1-week free trial and was satisfied enough with the allover       product to enroll in a paid contract-free month of service.  
 

Nightmare time! (1) What I selected to record to my library (cloud  storage) was 90% unplayable, despite constant attempts to run  them. (2) The few recordings which did play back could not be       deleted - DTN literally returned them to my library with each attempt to delete! - thus sitting on 6 precious hours of the tiny 20  hours of allotted cloud storage. (3) Programs I slated to record would not accept a change of mind: I could not stop the weekly recording event So, every week I saw another 3 hours of my 20  hours of cloud storage add on without any ability to actually watch those programs.

I wrote the first of three long chat discussions with DTN's Customer Service Team: a phone number is not an option for DTN customers as folks would be yelling at the poor reps all day and night! But I wanted chat, as it would leave a written transcript behind. I am glad I kept them. A case number was assigned, all details noted, and promises made to have the issues resolved  within the week. What I could not know was that this was the routine response to any and all customer complaints: make       promises, keep the customer attached to the account, take their money.

It is my belief that selling 'vapor ware' (software or programming  that does not exist except in the mind of the designer) is not only reprehensible but entirely unethical and can never be justified. I ended my third chat session with the comment to the poor rep that they must feel terrible knowing that, should they wish to keep their job, they can in no way make a promise to provide a refund. 

I tested this request but coming at the issue again and again: let me cut free, refund my money for three continued weeks of poor to non-existent service, and let me come back in six weeks. Again and  again the rep would reply that the Beta version was coming soon, almost ready, close to completion. ""Soon."" They would never define the word ""soon"" for me and I finally closed the third chat session       without telling the rep we were done.

I contacted my payment source, PayPal Credit, employed deliberately for the protection I knew PayPal would provide for poor product design, failure to deliver, etc. PayPal filed a case for me with DirecTV NOW two weeks ago, and I learned today that my refund was coming in.

The money is now in my PayPal account, making me (I believe) the  first person who has complained about DTN to actually get their  money back.

Deborah/Minnesota ",https://www.reddit.com/r/DirecTVNow/comments/9rrbqd/directv_now_service_complaint_results_in/,negative,-0.9066
3,2019-03-15 03:44:12,terryjohnson16,I dont intend to cancel...yet heres why,"I have the grandfathered $40 go big plan. Used to be $35. But i dont see the hype in the other competitors options. I looked at youtube tv offers, hulu tv etc and they all are missing channels that directv now offers the grandfathered plan members. Some are missing viacom channels while others are missing other major channels. Not one streaming company offers every major channel/network. They all have pieces of the pie and it gets you to think and choose which to take and at what price. 

If i switch i will losing more by switching. Yeah the price increased by $10 but the value is still for us grandfathered plan members. Value was still there even after they stopped allowing people to get the old $35/$40 grandfathered go big plan. That plan alone was $65. At that price its not worth it. 

I plan on hopefully keeping my grandfathered go big plan until they try to over price it. I have some people I recommended it to after their spectrum tv bill was reaching $200. 

Att wants people to drop the service so its less money they pay to the companies. 

Since the price increase rumor, people have been selling their $40 go big account here on reddit in record numbers. 

We all know att isn’t done yet raising their prices and channel reductions. 

Too bad the people that approve the stupid mergers don’t see how they companies lie just to get that approval. I wish there would be a scandal of how these companies pay/bribe the admins into these approvals. 

Im not a fan of john legere and the tmobile staff staying in trump hotels just to butter them up to get the merger approved with sprint but thats another topic...

Att claimed they would drive prices down. Its all lies. 

Imma stay...for now. 

Atts price increase antics...To be continued..",https://www.reddit.com/r/DirecTVNow/comments/b1a11f/i_dont_intend_to_cancelyet_heres_why/,negative,-0.5501
0,2018-12-28 17:36:58,BiggSlimm,What’s it going to take to get a stop button for DVR playback!!?, ,https://www.reddit.com/r/DirecTVNow/comments/aacdfb/whats_it_going_to_take_to_get_a_stop_button_for/,negative,-0.4184
0,2018-12-25 19:48:20,hermessocrates,Sooo where did ABC go,Why has ABC disappeared as soon as the NBA games started is this ESPN fighting direct Tv again ,https://www.reddit.com/r/DirecTVNow/comments/a9hpfb/sooo_where_did_abc_go/,negative,-0.5267
